<xs:schema xmlns:xs="http://www.w3.org/2001/XMLSchema">
    <xs:element name="BPMN-model">
        <xs:complexType>
            <xs:sequence>
                <xs:element type="xs:string" name="author"/>
                <xs:element type="xs:date" name="date"/>
                <xs:element type="xs:string" name="model-name"/>
                <xs:element name="streams">
                    <xs:complexType>
                        <xs:sequence>
                            <xs:element name="stream" maxOccurs="unbounded" minOccurs="0">
                                <xs:complexType>
                                    <xs:sequence>
                                        <xs:element name="from">
                                            <xs:complexType>
                                                <xs:simpleContent>
                                                    <xs:extension base="xs:string">
                                                        <xs:attribute type="xs:string" name="id" use="optional"/>
                                                        <xs:attribute type="xs:string" name="type" use="optional"/>
                                                        <xs:attribute type="xs:string" name="item-id" use="optional"/>
                                                    </xs:extension>
                                                </xs:simpleContent>
                                            </xs:complexType>
                                        </xs:element>
                                        <xs:element type="xs:string" name="stream-name" minOccurs="0"/>
                                        <xs:element name="to">
                                            <xs:complexType>
                                                <xs:simpleContent>
                                                    <xs:extension base="xs:string">
                                                        <xs:attribute type="xs:string" name="id" use="optional"/>
                                                        <xs:attribute type="xs:string" name="type" use="optional"/>
                                                        <xs:attribute type="xs:string" name="item-id" use="optional"/>
                                                    </xs:extension>
                                                </xs:simpleContent>
                                            </xs:complexType>
                                        </xs:element>
                                    </xs:sequence>
                                    <xs:attribute type="xs:string" name="id" use="optional"/>
                                </xs:complexType>
                            </xs:element>
                        </xs:sequence>
                    </xs:complexType>
                </xs:element>
                <xs:element name="tracks">
                    <xs:complexType>
                        <xs:sequence>
                            <xs:element name="track" maxOccurs="unbounded" minOccurs="0">
                                <xs:complexType>
                                    <xs:sequence>
                                        <xs:element name="actions">
                                            <xs:complexType>
                                                <xs:sequence>
                                                    <xs:element name="action" maxOccurs="unbounded" minOccurs="0">
                                                        <xs:complexType>
                                                            <xs:sequence>
                                                                <xs:element type="xs:string" name="operation"/>
                                                                <xs:element type="xs:short" name="time"/>
                                                            </xs:sequence>
                                                            <xs:attribute type="xs:string" name="id" use="optional"/>
                                                        </xs:complexType>
                                                    </xs:element>
                                                </xs:sequence>
                                            </xs:complexType>
                                        </xs:element>
                                        <xs:element name="events">
                                            <xs:complexType>
                                                <xs:sequence>
                                                    <xs:element name="event">
                                                        <xs:complexType>
                                                            <xs:sequence>
                                                                <xs:element type="xs:string" name="event-name"/>
                                                            </xs:sequence>
                                                            <xs:attribute type="xs:string" name="id" use="optional"/>
                                                            <xs:attribute type="xs:string" name="type" use="optional"/>
                                                        </xs:complexType>
                                                    </xs:element>
                                                </xs:sequence>
                                            </xs:complexType>
                                        </xs:element>
                                        <xs:element name="forks" minOccurs="0">
                                            <xs:complexType>
                                                <xs:sequence>
                                                    <xs:element name="fork">
                                                        <xs:complexType>
                                                            <xs:sequence>
                                                                <xs:element type="xs:string" name="condition"/>
                                                            </xs:sequence>
                                                            <xs:attribute type="xs:string" name="id"/>
                                                        </xs:complexType>
                                                    </xs:element>
                                                </xs:sequence>
                                            </xs:complexType>
                                        </xs:element>
                                        <xs:element type="xs:string" name="track-name"/>
                                    </xs:sequence>
                                    <xs:attribute type="xs:string" name="id" use="optional"/>
                                </xs:complexType>
                            </xs:element>
                        </xs:sequence>
                    </xs:complexType>
                </xs:element>
            </xs:sequence>
        </xs:complexType>
    </xs:element>
</xs:schema>